{
  "accepted": true,
  "as_of_datetime": "2026-06-21T09:47:17+00:00",
  "audit_id": "RKE-REPORT-INTELLIGENCE-TOOL-FEASIBILITY-AUDIT",
  "blocker_count": 0,
  "blockers": [],
  "checked_item_count": 20682,
  "checks": [
    {
      "accepted": true,
      "check_id": "RI-TOOL-00",
      "evidence": {
        "load_blocker_count": 0
      },
      "failure_count": 0,
      "failures": [],
      "requirement": "Required report-intelligence tool feasibility inputs load successfully."
    },
    {
      "accepted": true,
      "check_id": "RI-TOOL-01",
      "evidence": {
        "coverage_status_counts": {
          "exact_match": 165,
          "missing": 1819,
          "partial_match": 7
        },
        "metric_candidate_rows": 1991,
        "required_coverage_detail_fields": [
          "raw_source_match",
          "frequency_match",
          "pit_available",
          "lookback_supported",
          "unit_supported",
          "license_ok"
        ],
        "tool_coverage_match_rows": 1991
      },
      "failure_count": 0,
      "failures": [],
      "requirement": "Every metric candidate must have deterministic tool coverage with explicit PIT, lineage, frequency, unit, lookback, and license fields."
    },
    {
      "accepted": true,
      "check_id": "RI-TOOL-02",
      "evidence": {
        "allowed_priority_buckets": [
          "blocked",
          "resolved",
          "low",
          "medium",
          "high",
          "urgent"
        ],
        "gap_priority_counts": {
          "low": 87,
          "medium": 2524,
          "resolved": 241
        },
        "non_exact_coverage_rows": 1826,
        "tool_gap_rows": 2852
      },
      "failure_count": 0,
      "failures": [],
      "requirement": "Missing, partial, non-PIT, license-blocked, or engineering-blocked coverage must feed into the tool gap registry with bucketed priority."
    },
    {
      "accepted": true,
      "check_id": "RI-TOOL-03",
      "evidence": {
        "data_acquisition_proposal_rows": 2611,
        "tool_gap_rows": 2852
      },
      "failure_count": 0,
      "failures": [],
      "requirement": "Every tool gap must have a data acquisition proposal with explicit PIT, survivorship/restatement, required-field, and license requirements."
    },
    {
      "accepted": true,
      "check_id": "RI-TOOL-04",
      "evidence": {
        "minimum_required_effective_n": 30,
        "minimum_shadow_runtime_days": 60,
        "tool_design_proposal_rows": 2611,
        "tool_gap_rows": 2852
      },
      "failure_count": 0,
      "failures": [],
      "requirement": "Every tool gap must have a deterministic tool design proposal with input parameters, output schema, fallback policy, and validation plan."
    },
    {
      "accepted": true,
      "check_id": "RI-TOOL-05",
      "evidence": {
        "analysis_recipe_rows": 5774,
        "runtime_tool_gap_observation_rows": 2852,
        "safe_actionability": "no_trade_without_current_data_confirmation"
      },
      "failure_count": 0,
      "failures": [],
      "requirement": "Analysis recipes and runtime tool gaps must remain shadow-only; missing tools use explicit fallback observations that feed the gap registry."
    },
    {
      "accepted": true,
      "check_id": "RI-TOOL-06",
      "evidence": {
        "exact_coverage_count": 165,
        "paper_or_production_recipe_count": 0,
        "production_use_of_weighted_reports": false,
        "rollout_mode": "shadow_tooling"
      },
      "failure_count": 0,
      "failures": [],
      "requirement": "Tool feasibility can propose and shadow-build tools, but cannot promote recipes or report-derived methods until exact coverage, correctness, PIT history, license review, validation, paper trading, and rollout gates pass."
    }
  ],
  "policy": "report-intelligence tool feasibility requires deterministic coverage records, explicit PIT and license requirements, gap-to-proposal lineage, checker-validatable output schemas, bounded fallback policy, and shadow-only runtime until tool correctness and promotion gates pass",
  "run_id": "RIR-DERIVED-20260621T094633+0000"
}
