{
  "accepted": true,
  "as_of_datetime": "2026-06-22T20:24:20+00:00",
  "audit_id": "RKE-REPORT-INTELLIGENCE-PIT-LEAKAGE-AUDIT",
  "blocker_count": 0,
  "blockers": [],
  "checked_item_count": 13860,
  "checks": [
    {
      "accepted": true,
      "check_id": "RI-PIT-00",
      "evidence": {
        "load_blocker_count": 0
      },
      "failure_count": 0,
      "failures": [],
      "requirement": "Required report-intelligence PIT inputs load successfully."
    },
    {
      "accepted": true,
      "check_id": "RI-PIT-01",
      "evidence": {
        "forecast_claim_rows": 1048,
        "forecast_ledger_rows": 1048,
        "metadata_rows": 947
      },
      "failure_count": 0,
      "failures": [],
      "requirement": "Report accessible_datetime must be at or before claim/ledger decision datetime."
    },
    {
      "accepted": true,
      "check_id": "RI-PIT-02",
      "evidence": {
        "missing_data_vintage_count": 2377,
        "missing_data_vintage_policy": "allowed in shadow labels only; labels cannot become current tool evidence or production inputs without vintage fields",
        "outcome_label_rows": 2377,
        "stock_survivorship_policy": "allowed only for shadow stock proxy labels; promoted runtime requires a delisted-inclusive survivorship audit",
        "stock_survivorship_unverified_count": 2188
      },
      "failure_count": 0,
      "failures": [],
      "requirement": "Outcome labels must start after report access/signal and stay PIT/survivorship safe."
    },
    {
      "accepted": true,
      "check_id": "RI-PIT-03",
      "evidence": {
        "nonzero_source_profile_rows": 1241,
        "source_profile_rows": 1797,
        "weighted_context_rows": 1
      },
      "failure_count": 0,
      "failures": [],
      "requirement": "Source performance profiles can only use outcomes observed before the profile/context as-of time."
    },
    {
      "accepted": true,
      "check_id": "RI-PIT-04",
      "evidence": {
        "retrieved_claim_rows": 1048,
        "weighted_context_rows": 1
      },
      "failure_count": 0,
      "failures": [],
      "requirement": "Weighted research contexts cannot retrieve future reports or future claims."
    },
    {
      "accepted": true,
      "check_id": "RI-PIT-05",
      "evidence": {
        "non_pit_covered_tool_count": 0,
        "paper_or_production_recipe_count": 0,
        "tool_coverage_match_rows": 1934
      },
      "failure_count": 0,
      "failures": [],
      "requirement": "Tool availability checks must be PIT and non-PIT tools cannot support promoted recipes."
    },
    {
      "accepted": true,
      "check_id": "RI-PIT-06",
      "evidence": {
        "analysis_recipe_rows": 4708,
        "weighted_context_rows": 1
      },
      "failure_count": 0,
      "failures": [],
      "requirement": "Analysis recipe runtime_mode as_of_t must be respected by weighted contexts."
    },
    {
      "accepted": true,
      "check_id": "RI-PIT-07",
      "evidence": {
        "production_use_of_weighted_reports": false,
        "rollout_mode": "shadow_tooling"
      },
      "failure_count": 0,
      "failures": [],
      "requirement": "PIT-limited report intelligence remains shadow-only until validation and promotion gates pass."
    }
  ],
  "policy": "report intelligence is point-in-time constrained: report access, forecast signals, outcome labels, source weights, tool coverage, and recipe runtime modes must all be observed no later than the context as-of time before they can influence research priors",
  "run_id": "RIR-DERIVED-20260622T202326+0000"
}
